{
  "schema_id": "infinium.scan.effective-configuration/v1",
  "schema_version": "1",
  "configuration_id": "beth-light-val.slice4-fixture",
  "configuration_version": "1.3.0",
  "resolved_at": "2026-08-02T16:00:00.0000000\u002B00:00",
  "saved_configuration_reference": null,
  "analyzers": [
    {
      "analyzer_id": "bethesda-semantic-slice4",
      "analyzer_version": "1",
      "declaration_fingerprint": "0000000000000000000000000000000000000000000000000000000000000000",
      "enabled": true,
      "origin": "default"
    }
  ],
  "sources": [
    {
      "source_id": "retained-bethesda-fixture-inputs",
      "mode": "local-fixture",
      "enabled": true,
      "origin": "default"
    }
  ],
  "budgets": {
    "max_dispatch_count": 0,
    "max_input_tokens": 0,
    "max_output_tokens": 0,
    "max_hosted_search_calls": 0,
    "max_nano_usd": 0,
    "dispatch_deadline": "2026-08-02T16:02:00.0000000\u002B00:00",
    "origin": "default"
  },
  "cache_policy": {
    "analytical_mode": "force-clean-recomputation",
    "source_mode": "reuse-resolved-source",
    "provider_cache_mode": "disabled",
    "origin": "default"
  },
  "tracing": {
    "enabled": false,
    "level": "off",
    "sensitivity_label": "sensitive-development-diagnostic",
    "origin": "default"
  },
  "candidate_breadth": {
    "mode": "declared-mandatory-and-causal-lanes",
    "max_candidates": 1,
    "all_pairs_llm_comparison": false,
    "origin": "default"
  },
  "thresholds": [],
  "provider": {
    "mode": "disabled",
    "origin": "default"
  },
  "resources": {
    "max_general_workers": 1,
    "max_memory_bytes": 536870912,
    "max_output_bytes": 16777216,
    "origin": "default"
  },
  "semantic_context_overrides": []
}
